{
  "policy_version": "1",
  "default_action": "deny",
  "allowed_license_ids": [
    "0BSD",
    "Apache-2.0",
    "Artistic-2.0",
    "BSD-2-Clause",
    "BSD-3-Clause",
    "CC0-1.0",
    "EPL-2.0",
    "ISC",
    "MIT",
    "MPL-2.0",
    "Python-2.0",
    "Unicode-DFS-2016",
    "Unlicense",
    "Zlib"
  ],
  "denied_license_ids": [
    "AGPL-3.0-only",
    "AGPL-3.0-or-later",
    "GPL-2.0-only",
    "GPL-2.0-or-later",
    "GPL-3.0-only",
    "GPL-3.0-or-later"
  ]
}
